ts_utc,id,headline,link
2026-02-06T18:12:39Z,9425457,FinancialJuice: Goldman Sachs taps Anthropic's Claude to automate accounting and compliance roles - CNBC $GS,https://www.financialjuice.com/News/9425457/Goldman-Sachs-taps-Anthropics-Claude-to-automate-accounting-and-compliance-roles---CNBC-GS.aspx?xy=rss
2026-02-06T18:01:57Z,9425453,FinancialJuice: US Treasury Secretary Bessent's CNBC interview has ended,https://www.financialjuice.com/News/9425453/US-Treasury-Secretary-Bessents-CNBC-interview-has-ended.aspx?xy=rss
2026-02-06T18:01:15Z,9425442,"FinancialJuice: US Baker Hughes Oil Rig Count Actual 412 (Forecast -, Previous 411)",https://www.financialjuice.com/News/9425442/US-Baker-Hughes-Oil-Rig-Count-Actual-412-Forecast---Previous-411.aspx?xy=rss
2026-02-06T18:00:39Z,9425441,"FinancialJuice: US Baker Hughes Total Rig Count Actual 551 (Forecast -, Previous 546)",https://www.financialjuice.com/News/9425441/US-Baker-Hughes-Total-Rig-Count-Actual-551-Forecast---Previous-546.aspx?xy=rss
2026-02-06T17:59:25Z,9425422,FinancialJuice: US Treasury Secretary Bessent: A strong dollar policy is about what we do in the backdrop - CNBC Interview,https://www.financialjuice.com/News/9425422/US-Treasury-Secretary-Bessent-A-strong-dollar-policy-is-about-what-we-do-in-the-backdrop---CNBC-Interview.aspx?xy=rss
2026-02-06T17:45:39Z,9425411,FinancialJuice: Nvidia's CEO Huang: There's no drama with OpenAI. They need my company's new generation chips. $NVDA,https://www.financialjuice.com/News/9425411/Nvidias-CEO-Huang-Theres-no-drama-with-OpenAI-They-need-my-companys-new-generation-chips-NVDA.aspx?xy=rss
2026-02-06T17:44:50Z,9425403,FinancialJuice: Regional Diplomat briefed by Iran: Iran's missile capabilities were not discussed during the talks.,https://www.financialjuice.com/News/9425403/Regional-Diplomat-briefed-by-Iran-Irans-missile-capabilities-were-not-discussed-during-the-talks.aspx?xy=rss
2026-02-06T17:43:50Z,9425402,FinancialJuice: Regional Diplomat briefed by Iran: Iran ruled out no uranium enrichment but said it was open to discussing the level and purity of it or a regional consortium.,https://www.financialjuice.com/News/9425402/Regional-Diplomat-briefed-by-Iran-Iran-ruled-out-no-uranium-enrichment-but-said-it-was-open-to-discussing-the-level-and-purity-of-it-or-a-regional-consortium.aspx?xy=rss
2026-02-06T17:42:59Z,9425401,FinancialJuice: Fed's Jefferson: The current rate can support labor market while inflation is set to decline.,https://www.financialjuice.com/News/9425401/Feds-Jefferson-The-current-rate-can-support-labor-market-while-inflation-is-set-to-decline.aspx?xy=rss
2026-02-06T17:42:38Z,9425400,FinancialJuice: Regional Diplomat briefed by Iran: Iran believes US negotiators seemed to understand Iran's stance on enrichment.,https://www.financialjuice.com/News/9425400/Regional-Diplomat-briefed-by-Iran-Iran-believes-US-negotiators-seemed-to-understand-Irans-stance-on-enrichment.aspx?xy=rss
2026-02-06T17:42:08Z,9425399,FinancialJuice: Regional Diplomat briefed by Iran: Iran insisted on its right to enrich uranium' during talks with the US.,https://www.financialjuice.com/News/9425399/Regional-Diplomat-briefed-by-Iran-Iran-insisted-on-its-right-to-enrich-uranium-during-talks-with-the-US.aspx?xy=rss
2026-02-06T17:39:54Z,9425398,FinancialJuice: Fed's Jefferson: Once impact of tariffs on goods works through headline inflation should subside.,https://www.financialjuice.com/News/9425398/Feds-Jefferson-Once-impact-of-tariffs-on-goods-works-through-headline-inflation-should-subside.aspx?xy=rss
